{
  "schema_version": "steam-causal-overlay/v0.2",
  "overlay_id": "overlay:phase-e:correction-sensitive:inconclusive:v1",
  "example_id": "video_holmes:train:mKqiGQrHtW8:q684",
  "video_id": "mKqiGQrHtW8",
  "l1_observations": [
    {
      "node_id": "memory:evidence.event:faf09dbfa7",
      "video_id": "mKqiGQrHtW8",
      "time_span": {
        "start_s": 81.0,
        "end_s": 85.0
      },
      "provenance": {
        "created_by": "dataset_clip_wrapper.evidence_index",
        "source_graph_id": "clue_memory:video_holmes:train:mKqiGQrHtW8:q684",
        "source_schema_version": "video-skills-relaunch/v0.1",
        "source_node_type": "event",
        "adapter": "memory_graph.adapter.canonical_to_memory_nodes"
      },
      "node_type": "observation",
      "text": "Man examines handheld device.",
      "source_node_id": "evidence.event:faf09dbfa7",
      "source_segments": [
        "clip:mKqiGQrHtW8:fine:0028",
        "evidence.event:faf09dbfa7"
      ],
      "metadata": {
        "source_node_type": "event",
        "source_type": "event",
        "trust_level": null,
        "discovery_status": null,
        "granularity": null,
        "visibility": {
          "hidden_supervision": false,
          "mode": "video_only"
        },
        "confidence": null,
        "producer": "neighbor_vlm_l1_graph_composer",
        "modality": "mixed",
        "clip_id": "clip:mKqiGQrHtW8:fine:0028",
        "parent_clip_id": null,
        "local_node_id": "t_evt_1",
        "local_id_clip_id": "clip:mKqiGQrHtW8:fine:0028",
        "surface_form": null,
        "observable_facts": null,
        "events": null,
        "entities": null,
        "dialogue": null,
        "ocr_text": null,
        "source_l1_edges": [
          {
            "edge_id": "edge:9c5ecee57d",
            "src": "evidence.event:faf09dbfa7",
            "dst": "evidence.observation:5f4ddca163",
            "edge_type": "derived_from",
            "evidence_refs": [
              "evidence.event:faf09dbfa7",
              "evidence.observation:5f4ddca163"
            ],
            "producer": "neighbor_vlm_l1_reference_structuralizer"
          },
          {
            "edge_id": "edge:aeec58752e",
            "src": "evidence.event:faf09dbfa7",
            "dst": "evidence.entity_mention:148813fbbc",
            "edge_type": "entity_mention",
            "evidence_refs": [
              "evidence.event:faf09dbfa7",
              "evidence.entity_mention:148813fbbc"
            ],
            "producer": "neighbor_vlm_l1_reference_structuralizer"
          }
        ],
        "participants": [
          {
            "mention_id": "l1-track:evidence.entity_mention:148813fbbc",
            "role": "other",
            "entity_type": "person",
            "surface": "man",
            "confidence": 1.0,
            "grounding_refs": [
              "memory:evidence.event:faf09dbfa7"
            ],
            "source_l1_node_ids": [
              "evidence.entity_mention:148813fbbc"
            ],
            "identity_basis": "grounded_singleton_observation"
          }
        ],
        "states": [
          {
            "mention_id": "l1-track:evidence.entity_mention:148813fbbc",
            "attribute": "gaze_direction",
            "value": "looking down",
            "polarity": "positive",
            "confidence": 0.95,
            "grounding_refs": [
              "memory:evidence.event:faf09dbfa7"
            ],
            "source_l1_node_id": "evidence.state:9d86d6f787",
            "subject_source_l1_node_id": "evidence.entity_mention:148813fbbc",
            "subject_binding": "explicit_state_of",
            "contract_version": "grounded-state-assertion/v1"
          },
          {
            "mention_id": "l1-track:evidence.entity_mention:148813fbbc",
            "attribute": "expression",
            "value": "neutral",
            "polarity": "positive",
            "confidence": 0.8,
            "grounding_refs": [
              "memory:evidence.event:faf09dbfa7"
            ],
            "source_l1_node_id": "evidence.state:22a87b1865",
            "subject_source_l1_node_id": "evidence.entity_mention:148813fbbc",
            "subject_binding": "explicit_state_of",
            "contract_version": "grounded-state-assertion/v1"
          },
          {
            "mention_id": "l1-track:evidence.entity_mention:148813fbbc",
            "attribute": "visibility",
            "value": "partially obscured",
            "polarity": "positive",
            "confidence": 0.9,
            "grounding_refs": [
              "memory:evidence.event:faf09dbfa7"
            ],
            "source_l1_node_id": "evidence.state:b62efaa70d",
            "subject_source_l1_node_id": "evidence.entity_mention:148813fbbc",
            "subject_binding": "explicit_state_of",
            "contract_version": "grounded-state-assertion/v1"
          }
        ],
        "l1_structuralization": {
          "status": "grounded",
          "source_event_id": "evidence.event:faf09dbfa7",
          "source_clip_id": "clip:mKqiGQrHtW8:fine:0028",
          "participant_source_ids": [
            "evidence.entity_mention:148813fbbc"
          ],
          "state_source_ids": [
            "evidence.state:9d86d6f787",
            "evidence.state:22a87b1865",
            "evidence.state:b62efaa70d"
          ]
        }
      }
    },
    {
      "node_id": "memory:evidence.event:47ecad373c",
      "video_id": "mKqiGQrHtW8",
      "time_span": {
        "start_s": 141.0,
        "end_s": 145.0
      },
      "provenance": {
        "created_by": "dataset_clip_wrapper.evidence_index",
        "source_graph_id": "clue_memory:video_holmes:train:mKqiGQrHtW8:q684",
        "source_schema_version": "video-skills-relaunch/v0.1",
        "source_node_type": "event",
        "adapter": "memory_graph.adapter.canonical_to_memory_nodes"
      },
      "node_type": "observation",
      "text": "Man examines the wooden object.",
      "source_node_id": "evidence.event:47ecad373c",
      "source_segments": [
        "clip:mKqiGQrHtW8:fine:0048",
        "evidence.event:47ecad373c"
      ],
      "metadata": {
        "source_node_type": "event",
        "source_type": "event",
        "trust_level": null,
        "discovery_status": null,
        "granularity": null,
        "visibility": {
          "hidden_supervision": false,
          "mode": "video_only"
        },
        "confidence": null,
        "producer": "neighbor_vlm_l1_graph_composer",
        "modality": "mixed",
        "clip_id": "clip:mKqiGQrHtW8:fine:0048",
        "parent_clip_id": null,
        "local_node_id": "t_evt_examine_0048",
        "local_id_clip_id": "clip:mKqiGQrHtW8:fine:0048",
        "surface_form": null,
        "observable_facts": null,
        "events": null,
        "entities": null,
        "dialogue": null,
        "ocr_text": null,
        "source_l1_edges": [
          {
            "edge_id": "edge:f3f893adb4",
            "src": "evidence.event:47ecad373c",
            "dst": "evidence.observation:11f27a4c82",
            "edge_type": "derived_from",
            "evidence_refs": [
              "evidence.event:47ecad373c",
              "evidence.observation:11f27a4c82"
            ],
            "producer": "neighbor_vlm_l1_reference_structuralizer"
          },
          {
            "edge_id": "edge:a6f105fdb6",
            "src": "evidence.event:47ecad373c",
            "dst": "evidence.entity_mention:91381949b1",
            "edge_type": "entity_mention",
            "evidence_refs": [
              "evidence.event:47ecad373c",
              "evidence.entity_mention:91381949b1"
            ],
            "producer": "neighbor_vlm_l1_reference_structuralizer"
          },
          {
            "edge_id": "edge:1680dd01a4",
            "src": "evidence.event:47ecad373c",
            "dst": "evidence.entity_mention:ddaa4d819c",
            "edge_type": "entity_mention",
            "evidence_refs": [
              "evidence.event:47ecad373c",
              "evidence.entity_mention:ddaa4d819c"
            ],
            "producer": "neighbor_vlm_l1_reference_structuralizer"
          }
        ],
        "participants": [
          {
            "mention_id": "l1-track:evidence.entity_mention:91381949b1",
            "role": "other",
            "entity_type": "person",
            "surface": "man",
            "confidence": 1.0,
            "grounding_refs": [
              "memory:evidence.event:47ecad373c"
            ],
            "source_l1_node_ids": [
              "evidence.entity_mention:91381949b1"
            ],
            "identity_basis": "grounded_singleton_observation"
          },
          {
            "mention_id": "l1-track:evidence.entity_mention:ddaa4d819c",
            "role": "other",
            "entity_type": "object",
            "surface": "wooden object",
            "confidence": 1.0,
            "grounding_refs": [
              "memory:evidence.event:47ecad373c"
            ],
            "source_l1_node_ids": [
              "evidence.entity_mention:ddaa4d819c"
            ],
            "identity_basis": "grounded_singleton_observation"
          }
        ],
        "states": [
          {
            "mention_id": "l1-track:evidence.entity_mention:91381949b1",
            "attribute": "gaze_direction",
            "value": "downward",
            "polarity": "positive",
            "confidence": 0.95,
            "grounding_refs": [
              "memory:evidence.event:47ecad373c"
            ],
            "source_l1_node_id": "evidence.state:f91ebdff90",
            "subject_source_l1_node_id": "evidence.entity_mention:91381949b1",
            "subject_binding": "explicit_state_of",
            "contract_version": "grounded-state-assertion/v1"
          },
          {
            "mention_id": "l1-track:evidence.entity_mention:91381949b1",
            "attribute": "expression",
            "value": "focused",